{
  "$schema": "https://json-schema.org/draft/2020-12/schema",
  "$id": "chatbi-harness.schema.json",
  "title": "ChatBI Harness EffectiveConfig",
  "description": "Validated by the documented project subset only; this is not a claim of complete JSON Schema implementation.",
  "x-implemented-keywords": [
    "type",
    "required",
    "properties",
    "additionalProperties",
    "enum",
    "pattern",
    "propertyNames",
    "items",
    "minItems",
    "uniqueItems",
    "minimum"
  ],
  "type": "object",
  "required": [
    "schema_version",
    "workspace",
    "business_codebases",
    "adapters",
    "governance",
    "evaluation",
    "runtime"
  ],
  "properties": {
    "schema_version": {"type": "integer", "enum": [1]},
    "description": {"type": "string", "description": "Optional human-readable comment. Sanctioned outlet for notes; use this instead of ad-hoc _-prefixed fields, which the strict schema rejects."},
    "workspace": {
      "type": "object",
      "required": ["id", "root", "allow_candidate_writes", "protected_actions"],
      "properties": {
        "id": {"type": "string", "pattern": "^[a-z][a-z0-9_-]{1,62}$"},
        "root": {"type": "string", "enum": ["."]},
        "allow_candidate_writes": {"type": "boolean"},
        "protected_actions": {
          "type": "array",
          "uniqueItems": true,
          "items": {
            "type": "string",
            "enum": [
              "approve_metric",
              "change_access_policy",
              "production_publish",
              "destructive_migration"
            ]
          }
        }
      },
      "additionalProperties": false
    },
    "business_codebases": {
      "type": "object",
      "propertyNames": {"pattern": "^[a-z][a-z0-9_-]{1,62}$"},
      "additionalProperties": {
        "type": "object",
        "required": ["description", "path_ref", "read_mode", "git_history"],
        "properties": {
          "description": {"type": "string", "pattern": "\\S"},
          "path_ref": {"type": "string", "pattern": "^[a-z][a-z0-9_-]{1,62}$"},
          "read_mode": {"type": "string", "enum": ["adapter"]},
          "git_history": {"type": "string", "enum": ["metadata_only"]}
        },
        "additionalProperties": false
      }
    },
    "adapters": {
      "type": "object",
      "required": ["semantic", "query", "fixture_enabled"],
      "properties": {
        "semantic": {
          "type": "array",
          "uniqueItems": true,
          "items": {
            "type": "string",
            "pattern": "^(?:managed|cli|fixture):[a-z][a-z0-9_-]{1,62}$"
          }
        },
        "query": {
          "type": "array",
          "uniqueItems": true,
          "items": {
            "type": "string",
            "pattern": "^(?:managed|cli|fixture):[a-z][a-z0-9_-]{1,62}$"
          }
        },
        "fixture_enabled": {"type": "boolean"}
      },
      "additionalProperties": false
    },
    "governance": {
      "type": "object",
      "required": [
        "pii_policy_ref",
        "restricted_disclosure",
        "owners",
        "high_risk_classes"
      ],
      "properties": {
        "pii_policy_ref": {"type": ["string", "null"]},
        "restricted_disclosure": {
          "type": ["string", "null"],
          "enum": ["sql_only", null]
        },
        "owners": {
          "type": "object",
          "required": ["default_domain_owner", "metrics"],
          "properties": {
            "default_domain_owner": {"type": ["string", "null"]},
            "metrics": {
              "type": "object",
              "additionalProperties": {"type": "string"}
            }
          },
          "additionalProperties": false
        },
        "high_risk_classes": {
          "type": "array",
          "uniqueItems": true,
          "items": {
            "type": "string",
            "enum": [
              "executive",
              "regulated_or_pii",
              "core_finance",
              "raw_exploration",
              "freshness_unknown"
            ]
          }
        }
      },
      "additionalProperties": false
    },
    "evaluation": {
      "type": "object",
      "required": ["release_threshold", "threshold_owner", "require_p0_slices"],
      "properties": {
        "release_threshold": {"type": ["number", "null"], "minimum": 0},
        "threshold_owner": {"type": ["string", "null"]},
        "require_p0_slices": {"type": "boolean"}
      },
      "additionalProperties": false
    },
    "runtime": {
      "type": "object",
      "required": ["evidence_root", "fail_if_sandbox_unavailable"],
      "properties": {
        "evidence_root": {"type": "string", "enum": [".chatbi"]},
        "fail_if_sandbox_unavailable": {"type": "boolean"}
      },
      "additionalProperties": false
    },
    "path_bindings": {
      "type": "object",
      "propertyNames": {"pattern": "^[a-z][a-z0-9_-]{1,62}$"},
      "additionalProperties": {"type": "string"}
    },
    "cli_adapters": {
      "type": "object",
      "propertyNames": {"pattern": "^[a-z][a-z0-9_-]{1,62}$"},
      "additionalProperties": {
        "type": "object",
        "required": ["argv", "credential_env_names"],
        "properties": {
          "argv": {
            "type": "array",
            "minItems": 1,
            "items": {"type": "string", "pattern": "\\S"}
          },
          "credential_env_names": {
            "type": "array",
            "uniqueItems": true,
            "items": {
              "type": "string",
              "pattern": "^[A-Z_][A-Z0-9_]*$"
            }
          }
        },
        "additionalProperties": false
      }
    }
  },
  "additionalProperties": false
}
